id,product_name,company_name,manufacturing_date,expiration_date,serial_number,storage_instructions
4395,nam,da Luz Cardoso - ME,2023-09-20,2028-01-07,SH73 KPM3 3502 51G5 Y8O0 T5M8 SC6V,Culpa illum ducimus et nisi rerum. Sapiente recusandae suscipit amet amet similique facilis nihil.
1663,dolore,da Luz Cardoso - ME,2023-06-17,2025-03-24,V986 YQO1 2930 8BYA S9Q9 S0A4 6F8I,Odit tenetur consectetur asperiores id ipsum quasi. Eos quos dicta magnam dicta. Et suscipit officiis veritatis perspiciatis.
3548,vero,da Luz Cardoso - ME,2023-06-24,2030-05-13,PL35 R9RT 7918 4O5D S9G5 FKJ3 YX0B,Pariatur mollitia voluptatum rerum labore magni. Modi ipsum corporis facere quidem blanditiis. Aut itaque iusto voluptates temporibus illum modi.
4082,autem,Carvalho,2023-08-18,2024-06-14,KZ03 45ZA 5383 5DB0 O8G2 IV7C 4V3B,Voluptate ducimus dolorum consequuntur quos amet. Quam voluptatibus adipisci facere repellendus mollitia. Neque error optio necessitatibus blanditiis in molestiae.
9753,soluta,Silveira,2023-06-13,2113-08-30,9676 URJ4 0652 6MRT H0R9 UTY5 1Y4V,Necessitatibus ex numquam explicabo doloribus aliquid totam. Laboriosam illo mollitia commodi. Necessitatibus quam id praesentium odit eum. Molestias qui error corrupti officia esse.
